2022/1024,News,https://www.montsame.mn/en/read/256205,"Ulaanbaatar /MONTSAME/ Governor of the Capital City D.Sumiyabazar reports that he got inoculated with the first dose of Sinopharm vaccine against coronavirus along with Deputy Prime Minister S.Amarsaikhan today morning at the State Central Second Hospital.



Vaccination drive kicked off in Mongolia on February 23 with Oxford-AstraZeneca COVID-19 vaccine. As of today, more than 26 thousand citizens have received the first dose of vaccine against coronavirus.




According to  the schedule, 12-15 thousand salesmen and service workers are to be vaccinated today, March 10.




Incidentally, Mongolia registered four COVID-19 vaccines – Russia’s Sputnik-V, China’s Sinopharm, Oxford-AstraZeneca and Pfizer-BioNTech vaccine  – in the country’s drug registry. The World Health Organization has approved AstraZeneca and Pfizer vaccines for emergency use. It is expected that the WHO would approve Sputnik-V and Sinopharm vaccines for emergency use within this month.",https://www.montsame.mn/files/604845b3a3e77.png,2021-03-10,Montsame,Deputy PM and City Governor get the first dose of Sinopharm vaccine,
2022/1025,News,https://www.montsame.mn/en/read/256138,"On March 9, Prime Minister L.Oyun-Erdene met with Andrei Mikhnev, World Bank's Country Manager for Mongolia. 

At the meeting, PM Oyun-Erdene said that the World Bank has provided loans and grant assistance worth USD 1.3 billion to Mongolia in the past three decades, contributing immensely to maintain sustainable social and economic development and expressed gratitude for coordinating the Country Partnership Framework for 2021 to 2025 with Mongolia’s development policy and programs. Then, he mentioned that World Bank’s immediate financial assistance for Mongolia's fight against the pandemic has been of great importance.

In turn, Mr. Andrei Mikhnev noted that the World Bank will remain committed to coordinate its actions in Mongolia with the government’s MNT 10 trillion economic recovery and health protection plan and Vision – 2050 and to cooperate with Mongolia in economic diversification, digital transition, transparency, good governance and COVID-19 vaccine supply.",,2021-03-09,Montsame,World Bank to cooperate with Mongolia for COVID-19 vaccine supply,
2022/1026,News,https://www.montsame.mn/en/read/255699,"Ulaanbaatar /MONTSAME/ Yesterday, March 4, an online meeting was held on issues regarding production, use, approval and registration of Sputnik-V vaccine developed by the Russian Federation.



Mongolia has become the 23rd country to approve the use of Sputnik-V vaccine for emergency use and received the first 10,000 doses of Sputnik-V vaccine on February 27.



The meeting was organized by Rossotrudnichestvo Representative Office in Mongolia with participation of representatives from media organizations, doctors and medical scientists of the two countries, Mongolian Red Cross Society and Red Crescent Society, Mongol Em Impex Concern and Intermed Hospital.



Opening the meeting, Head of Rossotrudnichestvo Representative Office in Mongolia A.R.Bazarhandayev provided information on Sputnik-V vaccine. Russia registered ‘world's first’ vaccine against COVID-19 on August 11, 2020. So far 38 countries including Mongolia, Kazakhstan, Argentina, Algeria, Belarus, Bolivia, Palestine, Venezuela, Paraguay, Kyrgyz, Uzbekistan, Hungary, Iran, the United Arab Emirates, Tunisia, Armenia, Bosnia-Herzegovina, Montenegro, Myanmar, Bahrein, Lithuania, Guatemala, San-Marino, Egypt, Siri, Honduras and Vietnam, authorized the Sputnik V vaccine for emergency use. Out of them, nine countries have received the vaccine while 5 countries started using the vaccine in their immunization.



Sputnik-V vaccine is being manufactured in several factories including Gamaleya Institute, Binnopharm, FarmSyntez, R-Farm, Biocad and Generium. As of today, Russia has officially approved three COVID-19 vaccines including Sputnik-V and “EpiVacCorona” developed by Vektor State Research Center of Virology and Biotechnology in Novosibirsk and “KoviVac” by Scientific Center named after M.P.Chumakov and using the vaccines domestically and in other countries.  



Dr. Kurban Aitov from Irkutsk State Medical University emphasized COVID vaccines developed by Russia have not shown any serious adverse effects.




Citing that the Mongolian Government is involving its population in immunization free of charge, Member of Parliament J.Chinburen noted that the country is facing the necessity to expand its vaccination. He also said “ Mongolia has become ready to use the Sputnik-V vaccine in immunization after its approval by the World Health Organization. I am confident that the Russian Federation would lead in development and production of other types of vaccines.”



Director in charge of Foreign Relations and Cooperation of ‘Mongol Em Impex Concern” LLC B.Munkh-Erdene said that our company is supplying other necessary medications that are required in time of COVID-19 pandemic aside from the coronavirus vaccine. We have made a number of researches and obtained information on vaccines being developed by world developed countries. In doing so, we found out Russia’s Sputnik-V vaccine has a high efficacy. Mongolia will receive 20 thousand doses of Sputnik-V vaccine by the order of Government. The first batch of 10 thousand doses of the vaccine was supplied to Mongolia on February 27 and the next batch of vaccine is expected to arrive by March 10. A negotiation to bring 200-250 thousand doses of vaccine monthly further is under discussion.      ",https://www.montsame.mn/files/6041cab4b962a.jpeg,2021-03-05,Montsame,Online meeting held on issues regarding Sputnik-V vaccine,
2022/1027,News,https://www.montsame.mn/en/read/255728,"Ulaanbaatar /MONTSAME/. On March 4, an interim committee responsible for monthly open hearing and discussion on and overseeing the implementation of the law on COVID-19 prevention and combat and reducing its negative socio-economic impact convened for a regular meeting at the State House. 



Minister of Health S.Enkhbold during the meeting delivered a presentation on the nation’s vaccination drive against COVID-19, which was launched on February 23, 2021. 



Mongolia has planned to vaccinate 60 percent of its population or around 1.9 million people above the age of 18 within its vaccination campaign, a total of 470,000 doses of coronavirus vaccines, including 150,000 doses of AstraZeneca from India, 300,000 doses of Sinopharm from China and 20,000 doses of Sputnik V from Russia have arrived in Mongolia so far. 



The Health Minister informed it was agreed that Mongolia to receive another 112,000 doses of AstraZeneca vaccine under COVAX mechanism - a multilateral initiative aimed at accelerating the development and manufacturing of the coronavirus vaccines and guaranteeing fair and equitable access for every country in the world, until June 2021.



Out of them, 14,400 doses will arrive in Mongolia within March 15. In addition, talks are underway within the collaboration between the Mongolian government and the COVAX Facility to get 25,000 doses of Pfizer vaccine. 



According to him, Russia has also pledged to provide more Sputnik V vaccine as assistance and the government is also studying to purchase 200,000 doses of the Sputnik V vaccine by early-May and also buy 300,000 doses of Sinopharm vaccine within April this year. ",https://www.montsame.mn/files/6040f24dcbeed.jpeg,2021-03-05,Montsame,"Mongolia to receive 14,400 doses of AstraZeneca vaccine by March 15",
2022/1028,News,https://www.montsame.mn/en/read/255213,"Ulaanbaatar /MONTSAME/ On February 27, Mongolia received first 10 thousand doses of Sputnik V vaccine developed by the Russian Federation.



The vaccine was brought by a cargo charter flight in route of Seoul-Ulaanbaatar and the next batch of 10 thousand doses of Sputnik V vaccine is planned to arrive within the first week of March. Thus, Mongolia will receive 20 thousand doses of Sputnik V vaccine against coronavirus by the order of the Government.




Minister of Health S.Enkhbold, State Secretary of the Ministry of Health Ts.Erdembileg and Trade Representative of the Russian Federation in Mongolia Maksim V.Vasilev attended the vaccine handing-over ceremony.




In February 2021, the Mongolian Ministry of Health approved the use of Sputnik V vaccine developed by the N.F.Gamaleya Scientific Research Institute of Epidemiology and Microbiology. 




The World Health Organization plans to approve the Sputnik V vaccine for emergency use within March. Furthermore, over 40 countries have registered Sputnik V vaccine in the drug registry to vaccinate their citizens after the approval by the WHO and the scientists defined that the vaccine has 92 percent efficacy, the Ministry of Health reports. ",https://www.montsame.mn/files/603c5bf4f32d2.jpeg,2021-03-01,Montsame,First 10 thousand doses of Sputnik V vaccine received,
2022/1029,News,https://www.montsame.mn/en/read/254452,"150,000 doses of Made in India, Covishield Astra Zeneca Vaccine granted by Government of India have arrived in Mongolia today on February 22, and have been handed over by Ambassador of IM P Singh to Deputy Prime Minister of Mongolia S. Amarsaikhan in a special ceremony held at Buyant-Ukhaa Airport.

 

In his remarks, Ambassador M P Singh said that India is glad to be the first nation to provide Covid vaccine to the ‘Spiritual Neighbour’ and ‘Strategic Partner’ Mongolia, in the very first phase, in which 6.3 million vaccines have been gifted to 13 friendly nations. This gesture demonstrates our cooperative and collaborative spirit, our bond of hearts and the importance of Mongolia in our ‘Act East’ policy.

 

Deputy Prime Minister S.Amarsaikhan thanked the Prime Minister of India for placing Mongolia at the forefront of the list of countries for supply of 150,000 Covid vaccines, and mentioned that today’s event will go down in history. The Deputy Prime Minister then said, “The Mongolia-India strategic partnership is expanding and joint projects and programs are being implemented successfully in various fields to strengthen friendship between the people of Mongolia and India.”

 

The Ambassador expressed hope that the vaccination program, expected to commence shortly in Mongolia, will provide required health security in the country, reinforce the safety of the Mongolian healthcare & frontline workers, and serve as a contribution in bringing the Mongolian economy back to normal growth.

 

In addition to the doses gifted today, India stands ready to assist Mongolia in securing extra supplies of Covid vaccines from India on a commercial basis.",,2021-02-22,Montsame,Mongolia receives first COVID vaccine from India,
2022/1031,News,https://www.montsame.mn/en/read/254116,"On February 18, Prime Minister L.Oyun-Erdene held a meeting with U.S. Ambassador to Mongolia Michael S.?Klecheski. 



At the meeting, the Prime Minister noted his delight with the development of strategic partnership between Mongolia and the United States and reaffirmed his willingness to bring the bilateral relationship to a new level. 



Moreover, PM Oyun-Erdene emphasized the U.S. Agency for International Development (USAID)’s resume of operations in Mongolia in the year of 2020 and the U.S. support for Mongolia’s removal from the Financial Action Task Force (FATF)’s so-called ‘grey-list’ as well as effective preparations for entry-into-force of the Mongolia Water Compact by the U.S. Millennium Challenge Corporation. 



After briefly presenting about the Mongolia’s response measures to COVID-19 pandemic, the Prime Minster put forward a request for the U.S. support to access COVID-19 Pfizer vaccines within the framework of the COVAX Facility. 



Mentioning that Mongolia has committed to pay special attention on the development of the education sector and to make English as a second language of the country, PM Oyun-Erdene stressed opportunities for cooperation in these areas. 



In turn, Ambassador Michael S.?Klecheski congratulated the Prime Minister for his appointment and affirmed the commitment of the new administration of the United States for the consistent development of the strategic partnership between Mongolia and the U.S. 



The meeting also touched on active bilateral cooperation in areas of politics, economy, defense and at the regional and international levels. ",,2021-02-18,Montsame,Prime Minister asks for U.S. support for access to COVID-19 vaccine,
2022/1032,News,https://www.montsame.mn/en/read/253418,"WASHINGTON, February 11, 2021 – The World Bank Board of Executive Directors today approved additional financing in the amount of $50.7 million for the Mongolia COVID-19 Emergency Response and Health System Preparedness Project to enable affordable and equitable access to vaccines in the country.

 

The funding has been approved at a crucial juncture in the government’s response to COVID-19. Mongolia has taken strong measures to prevent and contain the COVID-19 outbreak since the beginning of 2020. Despite the relatively low number of cases in Mongolia, further community spread risks remain high. To reduce this risk, further preventive measures, supporting health system improvements, and providing access to COVID-19 vaccines are critical.

 

To support the Mongolian government’s strategy to vaccinate at least 60 percent of its population, the additional financing will help pay for purchase and deployment of COVID-19 vaccines. Given the urgent need to expand immunization capacity, it will support comprehensive measures for effective vaccine delivery, such as cold chain upgrade, logistics, national and local roll-out plans, public information campaigns, and staff training.

 

“Access to safe and effective vaccines will be critical to protecting lives and accelerating economic and social recovery in Mongolia,” said Andrei Mikhnev, World Bank Country Manager for Mongolia. “This additional financing approved today will enable affordable and equitable access to vaccines and play a critical role in further strengthening the health system in Mongolia.”

 

The World Bank is part of multilateral efforts such as ACT-A and COVAX and is cooperating closely with WHO and UNICEF who continue to play an integral role in supporting vaccine deployment and building capacity of health care workers.

 

The Mongolia COVID-19 Emergency Response and Health System Preparedness Project, approved in April 2020, is helping strengthen health system preparedness and diagnostic capacity through procurement of essential medical equipment and personal protective equipment for three tertiary hospitals as well as hospitals of 21 provinces and 9 districts of Ulaanbaatar city.

 

World Bank Group Response to COVID-19

 


The World Bank, one of the largest sources of funding and knowledge for developing countries, is taking broad, fast action to help developing countries respond to the health, social and economic impacts of COVID-19. This includes $12 billion to help low- and middle-income countries purchase and distribute COVID-19 vaccines, tests, and treatments, and strengthen vaccination systems. The financing builds on the broader World Bank Group COVID-19 response, which is helping more than 100 countries strengthen health systems, support the poorest households, and create supportive conditions to maintain livelihoods and jobs for those hit hardest.",https://www.montsame.mn/files/6025ea82bd2aa.png,2021-02-12,Montsame,World Bank Approves $50.7 Million for Affordable and Equitable COVID-19 Vaccine Access in Mongolia,
2022/1033,News,https://www.montsame.mn/en/read/253142,"On February 9, the Russian Direct Investment Fund (RDIF, Russia’s sovereign wealth fund) announces the registration of the Russian Sputnik V vaccine against coronavirus by the Ministry of Health of Mongolia.



The vaccine was approved under the emergency use authorization procedure without additional clinical trials in the country. The EUA was obtained with the assistance from RDIF's local partner Mongol Emimpex Concern LLC, the country's leading pharmaceutical company.



Mongolia has become the 23rd country in the world to approve Sputnik V. The vaccine had been approved earlier in Russia, Belarus, Argentina, Bolivia, Serbia, Algeria, Palestine, Venezuela, Paraguay, Turkmenistan, Hungary, UAE, Iran, Republic of Guinea, Tunisia, Armenia, Mexico, Nicaragua, Republika Srpska (entity of Bosnia and Herzegovina), Lebanon, Myanmar and Pakistan.



Kirill Dmitriev, CEO of the Russian Direct Investment Fund said “Partners in Mongolia decided to authorize the vaccine after conducting a thorough review of the data of Sputnik V clinical trial demonstrating its high efficacy and safety as confirmed by the publication in The Lancet magazine. Sputnik V is one of the leading vaccines in the world and the number of registrations of the vaccine keeps growing day by day.”



Sputnik V has a number of key advantages:



Efficacy of Sputnik V is 91.6% as confirmed by the data published in the Lancet, one of the world's oldest and most respected medical journals; it is one of only three vaccines in the world with efficacy of over 90%; Sputnik V provides full protection against severe cases of COVID-19.
The Sputnik V vaccine is based on a proven and well-studied platform of human adenoviral vectors, which cause the common cold and have been around for thousands of years.
Sputnik V uses two different vectors for the two shots in a course of vaccination, providing immunity with a longer duration than vaccines using the same delivery mechanism for both shots.
The safety, efficacy and lack of negative long-term effects of adenoviral vaccines have been proven by more than 250 clinical studies over two decades.
The developers of the Sputnik V vaccine are working collaboratively with AstraZeneca on a joint clinical trial to improve the efficacy of AstraZeneca vaccine.
There are no strong allergies caused by Sputnik V.
The storage temperature of Sputnik V at +2+8 C means it can be stored in a conventional refrigerator without any need to invest in additional cold-chain infrastructure.
The price of Sputnik V is less than $10 per shot, making it affordable around the world.",https://www.montsame.mn/files/60235381532ba.jpeg,2021-02-10,Montsame,Mongolia approves Russia’s Sputnik V vaccine against COVID-19,
2022/1034,News,https://www.montsame.mn/en/read/252685,"Ulaanbaatar /MONTSAME/ On February 1, Chinese foreign ministry spokesperson Wang Wenbin said on regular press conference that China is providing vaccine aid to developing countries including Mongolia.



Wang Wenbin: China has been acting through concrete actions on President Xi Jinping's solemn commitment of making COVID-19 vaccines, developed and deployed in China, a global public good, thus contributing to greater accessibility and affordability of vaccines in developing countries. That's what we've been saying and what we've been doing.



First, apart from Pakistan, China is also providing vaccine aid to Brunei, Nepal, the Philippines, Myanmar, Cambodia, Laos, Sri Lanka, Mongolia, Palestine, Belarus, Sierra Leone, Zimbabwe and Equatorial Guinea, altogether 13 developing countries. Going forward, we will also assist another 38 developing countries with vaccines. We also take an active part in the WHO-led COVAX and provide vaccines through this platform to developing countries.



Second, China supports Chinese companies in conducting joint vaccine R&D and production with foreign partners. Vaccines made by Sinopharm and Sinovac have been exported to countries including the UAE, Morocco, Indonesia, Turkey, Brazil and Chile where clinical studies have been conducted.



Third, China supports relevant companies in exporting vaccines to countries in urgent need that have approved Chinese vaccines and authorized their emergency use. For instance, Serbia has started vaccination with recently imported Chinese-made vaccines. More and more countries are approving the domestic use of Chinese vaccines.



The whole world needs to pull together in order to defeat the pandemic. China will continue to provide in a timely manner, to the best of its capability, vaccines to relevant countries, especially the developing countries, and contribute its share to building a global community of health for all. We also hope the international community will work together to promote the equitable allocation and use of vaccines globally to make sure developing countries have access to and can afford them.",https://www.montsame.mn/files/601d0ca55291e.jpeg,2021-02-05,Montsame,China to provide vaccine aid to developing countries including Mongolia,
2022/1035,News,https://www.montsame.mn/en/read/253062,"Ulaanbaatar /MONTSAME/ On February 9, Minister of Health S.Enkhbold received Ambassador of China to Mongolia Chai Wenrui.



At the beginning of the meeting, the Ambassador underlined that cooperation in health sector is a big part of Comprehensive Partnership relations between the two countries and cooperation between the two Ministries of Health has been running successfully in recent years. Especially, no infection case of COVID-19 has been transmitted between the two countries as a result of providing mutual support and working closely by exchanging information, the Ambassador pointed out. 



Citing that at his address to the World Health Assembly 2020 President of China Xi Jinping noted that China would develop COVID-19 vaccine and provide it to countries, the Ambassador said the statement came into action as the country made a decision to supply 10 million doses of vaccine to COVAX program. ""Concurrently with it, China will provide vaccine aid to 53 developing countries and Mongolia is in the list of countries that will receive the vaccine in priority."" 




Expressing his sincere gratitude to the Government of China on rendering non-refundable aid of necessary medical equipment and personal protective equipment to Mongolia and sharing knowledge and experience, the Health Minister briefed about some measures being taken in regard with the increase of community infection clusters in the capital city and preparation works for vaccination.




The Minister also voiced to make efforts for keeping success of zero infection transmission between the two countries further alongside developing bilateral cooperation in health sector in many other directions once the pandemic subsides.

",https://www.montsame.mn/files/60224af643213.jpeg,2021-02-09,Montsame,China to donate COVID-19 vaccine to Mongolia,
2022/1036,News,https://www.montsame.mn/en/read/252232,"A composition of the working group responsible for importing vaccines against COVID-19 has been renewed and is being chaired by newly-appointed Deputy Prime Minister S.Amarsaikhan. 



On February 2, 2021, the working group convened and Prime Minister L.Oyun-Erdene took part in the meeting to hear updates on the talks underway with COVID-19 vaccine manufacturers and countries developing the vaccines. 



According to the Press Office of the Cabinet Secretariat, the working group views that it is crucial to promptly bring the vaccines to receive under the World Health Organization’s COVID-19 Vaccines Global Access program and to intensify the talks ongoing with other countries on receiving COVID-19 vaccines available. ",https://www.montsame.mn/files/6018eb622a3a8.jpeg,2021-02-02,Montsame,Working group in charge of importing COVID-19 vaccine meets,
2022/1037,News,https://www.montsame.mn/en/read/247532,"Ulaanbaatar /MONTSAME/. Prime Minister of Mongolia U.Khurelsukh received WHO Representative in Mongolia Sergey Diorditsa today.




During the meeting, they exchanged views on the current state of COVID-19 pandemic and the measures being taken to tackle the spread. Prime Minister U.Khurelsukh emphasized that the government of Mongolia intends to import high-quality vaccines approved by the World Health Organization as soon as possible. He also thanked the United Nations, especially the World Health Organization, for continuing to provide assistance and support to Mongolia in overcoming the pandemic, and said that professional and methodological advice on combating the pandemic and controlling the spread of the infection has been most significant.



The parties discussed the possibility of importing vaccines to Mongolia in the first quarter of 2021 within the framework of COVAX. Representative Sergey Diorditsa also provided information on the progress of some vaccines being developed internationally.



Moreover, he underscored that the measures taken by the Government of Mongolia and the State Emergency Commission, the transition to a state of readiness, and the quarantine regime were timely solutions.",https://www.montsame.mn/files/5fe061787ac22.jpeg,2020-12-21,Montsame,Importing of vaccine to Mongolia in the first quarter of 2021 discussed,
2022/1038,News,https://www.montsame.mn/en/read/245975,"Ulaanbaatar/MONTSAME/. On December 7, Minister of Finance Ch.Khurelbaatar, as a head of the Working Group responsible for COVID-19 vaccine procurement of Mongolia, held a meeting with the Russian Ambassador to Mongolia I.K. Azizov.


During the meeting, the Finance Minister inquired about the cost of Sputnik-V vaccine, its supply, and the progress of mass vaccination in Russia. 

The Ambassador said that the Sputnik-V vaccine could be supplied to Mongolia at a lower price and from two nearest sources. 

According to the Ambassador, the mass vaccination in Moscow began last week, and the vaccine’s registration procedure with the World Health Organization is in full swing.",https://www.montsame.mn/files/5fcf0f1ccc114.png,2020-12-08,Montsame,Finance Minister discusses COVID-19 vaccine-related issues with Russian Ambassador,
