2022/1039,News,https://www.montsame.mn/en/read/245222,"Ulaanbaatar /MONTSAME/. On November 30, President of Mongolia Battulga Khaltmaa held a meeting with officials from British-Swedish pharmaceutical company AstraZeneca via teleconference to exchange views on supplying coronavirus vaccine, being developed by the company, to Mongolia. 



The AZD1222 coronavirus vaccine, under development by the University of Oxford and AstraZeneca, has shown 70 percent efficacy, as reported by the pharmaceutical company on November 23. 



At the outset of the meeting, President Battulga commended the AstraZeneca for exerting great efforts in developing and supplying the vaccine that is crucial in the fight against COVID-19 global pandemic. He then noted that since more than half of Mongolia’s population lives in the capital city of Ulaanbaatar, posing an increased risk of spreading the virus, it is important to vaccinate the entire population within a short period of time when it becomes available.



The President expressed his eagerness to first purchase COVID-19 vaccines being developed by the company as soon as they start producing. 



In turn, the AstraZeneca company expressed their delight with the fact that President of Mongolia is himself attaching significance to this issue, and also pledged to cooperate with Mongolia and include Mongolia among the first countries to receive vaccine shipments when they start selling. 



At the meeting, President Battulga informed that he will be giving directions to the Government and the State Emergency Commission of Mongolia to ensure preparation for purchasing the AstraZeneca’s vaccine. ",https://www.montsame.mn/files/5fc61e3b716cd.jpeg,2020-12-01,Montsame,Mongolia to prepare to buy AstraZeneca’s COVID-19 vaccine,
2022/1040,News,https://www.montsame.mn/en/read/245959,"Ulaanbaatar /MONTSAME/ On December 7, Minister of Finance Ch.Khurelbaatar held meetings with Ambassadors of the United Kingdom, Russia, China and the United States to Mongolia, discussing about containing spread of COVID-19 pandemic, overcoming economic crisis and COVID-19 vaccine procurement.







The Minister first met with British Ambassador Philip Malone. UK is one of the largest contributors who granted financing of GBP 550 million to Covax AMC program aimed at providing 92 developing countries with equal access to receive vaccine as well as financing of GBP 800 million to Covax ACT accelerator mechanism for increasing accessibility of COVID-19 treatment, test kit and vaccine. Also the country's AstraZeneca company has developed COVID-19 vaccine that is highly resistant to storage and transportation among other vaccines which are under development.








During the meeting with Chinese Ambassador Chai Wenrui, the sides talked over the vaccine being developed in the country, its testing, registration, development progress and possibilities to supply the vaccine to Mongolia once its development completes. Furthermore, the Finance Minister asked the Chinese Ambassador to promptly resolve any issues related to ensuring safety of coal transport and protect lives and health of coal truck drivers, border and customs officials in this difficult time of the COVID-19 pandemic and attach attention on trade and economic sustainability of the two countries.








When the Finance Minister received U.S. Ambassador Michael Klecheski, he expressed his gratitude to the U.S. on presenting 50 ventilator breathing apparatus, personal protective gears and equipment and rapid test kits to Mongolia this week to help the country’s effort to combat the COVID-19 pandemic. Furthermore, the sides shared views on possibilities to procure Moderna vaccine developed in the USA and its quick transport.

",https://www.montsame.mn/uploads/content/5b26aa55786a686d941bf0edc31fa04c.png,2020-12-08,Montsame,COVID-19 vaccine related issues discussed with Ambassadors,
2022/1041,News,https://www.montsame.mn/en/read/243818,"Following the cabinet meeting held on November 18, Minister of Finance Ch.Khurelbaatar delivered a media presentation on the spending report of foreign loans and assistance received by the government.



According to him, the Government has signed loan agreements with 4 international organizations and development partner countries for its COVID-19 response measures, totaling USD 299.5 million. Out of the total proposed international funds, USD 199.5 million has already been received, including USD 100 million from the Asian Development Bank's COVID-19 Rapid Response Program and USD 99.5 million under the Rapid Financing Instrument of the International Monetary Fund. The remainder USD 100 million loan from the Asian Infrastructure Investment Bank is expected within the fourth quarter of 2020.



The government has also established international agreements of loans and grants worth USD 119.4 million for 10 projects and measures to serve as budget support against COVID-19 pandemic. USD 32.5 million of them has been already received and was spent for the procurement of medical supplies and equipment with a view to alleviate the impact of COVID-19 pandemic. The remaining USD 86.8 million is expected in the last quarter of this year to be spent for much-needed medical supplies. 



The Asian Development Bank is providing the largest amount of loan and assistance, allocating a total of USD 160.1 million. Out of USD 128.1 million of funds that has already been received by Mongolia as of now, USD 100 million loan was provided as a budget support for government programs, such as ‘Child Money’ allowance and forgiveness of pension-secured loans. 



Another 1.2. million loan from the ADB has been spent for purchasing and distribution of 572 types of medical supplies to Ulaanbaatar’s and local hospitals, and USD 26.4 million loan lessen the socioeconomic impacts of COVID-19 has been spent for financing Child Money program and food stamps for vulnerable groups. 



Furthermore, ADB has provided USD 1 million grants for purchasing computed tomography equipment for the National Center for Communicable Diseases, and another USD 1.5 million grants will be provided by ADB for enhancing PCR laboratories countrywide. 



In the scope of proposed funds from the ADB, USD 30 million financing within the COVID-19 Rapid Response Program will be spent for purchasing 2,923 units of medical diagnostic equipment, 68,128 personal protective equipment and ambulances for 21 aimags, and refurbishment of sterilization departments at 7 aimag’s clinics. 



Moreover, Mongolia has already received following funds and assistance, including 

-        Assistance of medical supplies and PPE worth USD 700,000 from China 

-        EUR 16 million of grants as budget support as part of the European Union’s EUR 50.8 million of assistance for Mongolia’s COVID-19 related short, medium, and long term projects, 

-        USD 99.5 million loan from the International Monetary Fund Mongolia under the Rapid Financing Instrument 

-        USD 19.3 million from the World Bank as part of various assistance projects for Mongolia's COVID-19 response, 

-        USD 2.5 million from the USAID for purchasing medical supplies and equipment necessary for providing support to vulnerable groups, 

-        USD 1.5 million from Germany for PPE and medical equipment as well as improving vocational education in Mongolia, 

-        USD 2.6 million from the United Nations organizations as technical assistance to strengthen capacity of 7 laboratories in 4 regions and to address preparedness and prevention of diseases in schools and kindergartens. 



Minister Khurelbaatar further informed that Mongolia has already applied to purchase COVID-19 vaccine with USD 50.6 million funding from the World Bank and has joined the Covax Facility, a global initiative that brings together governments and manufacturers to ensure eventual COVID-19 vaccines reach those in greatest need. “Therefore, we believe that Mongolia has a higher chance of gaining access to coronavirus vaccine when available” said the Minister of Finance. ",https://www.montsame.mn/files/5fb62ac8cff06.jpeg,2020-11-19,Montsame,Finance Minister: Mongolia has applied to purchase COVID-19 vaccine,
2022/1042,News,https://www.montsame.mn/en/read/235100,"Ulaanbaatar /MONTSAME/ Minister of Health T.Munkhsaikhan met with Ambassador Extraordinary and Plenipotentiary of the Russian Federation to Mongolia I.K.Azizov to exchange views on cooperation between the two countries in healthcare sector.



Ambassador I.K.Azizov congratulated Minister T.Munkhsaikhan on his appointment and briefly outlined the Covid-19 situation in Russia, while informing the Health Minister of the efforts and initiatives that have been jointly undertaken by the two sides in healthcare.



He said less than 5,000 cases were recorded in Russia per day over the last 9 days and that the number of new cases has been relatively low in its territories bordering Mongolia and high in Moscow. The Russian side also voiced its readiness to provide Mongolia with 'Sputnik V' coronavirus vaccine if it proves to be a success in trials.



Ambassador I.K.Azizov invited Mongolian healthcare professionals to participate in maternal and child health training sessions at Russian research institutions between this October and December and commended the effectiveness of the Mongolian government’s Covid-19 efforts.



Minister T.Munkhsaikhan concurred with the Ambassador that bilateral relations and cooperation in healthcare have been expanding and noted that the regular participation of Mongolian healthcare workers in the theoretical and practical training sessions held at research institutions in Moscow and Saint Petersburg greatly contributes to the improvement of maternal and child healthcare services in Mongolia.



The Minister thanked the Russian side for providing rapid tests amid the pandemic for hospital pandemic preparedness and infection prevention and informed that the government is now taking precautions to further prevent local transmissions and cope with a local outbreak with least damage possible should any occur and to be fully prepared for seasonal flu.



Moreover, at the meeting, the sides discussed at length the above-mentioned matters and other joint efforts and Minister T.Munkhsaikhan spoke of his plans for the sector.",https://www.montsame.mn/files/5f4dcdf678f0d.jpeg,2020-09-01,Montsame,Russia ready to provide Mongolia with coronavirus vaccine if trials prove successful,
2022/1043,News,https://www.montsame.mn/en/read/268058,"On June 23, the second batch of Pfizer-BioNTech COVID-19 vaccines were received per the agreement signed between the Government of Mongolia and Pfizer Inc signed in May 2021 for 2.5 million doses of vaccine in 2021. 



458 kg of vaccines were brought on a MIAT Mongolian Airlines flight OM 7304 in route Seoul-Ulaanbaatar. The first shipment of the vaccines were received on June 16, and the rest will be delivered in the second half of 2021.



The vaccines are being provided through the ,’COVID-19 pandemic and Public Health Emergency Capacity Building Project’ being implemented through the United Nations Children’s Fund (UNICEF) under a grant from the Government of Japan.



Pregnant women and nursing mothers, and chronically ill patients as well as children aged 16-17 are being administered with the Pfizer vaccine.",https://www.montsame.mn/files/60d405c76dd3e.jpeg,2021-06-24,Montsame,Second batch of Pfizer-BioNTech vaccines received,
2022/1044,News,https://www.montsame.mn/en/read/265358,"The Asian Development Bank (ADB) today, May 28, approved a loan package of USD 19 million for Mongolia to purchase safe and effective vaccines against the coronavirus disease (COVID-19). The project is part of ADB’s USD 9 billion Asia Pacific Vaccine Access Facility (APVAX), which was launched in December 2020 to offer rapid and equitable vaccine-related support to ADB’s developing member countries.

“COVID-19 has caused considerable disruption to Mongolia’s health, well-being, and economy,” said ADB President Masatsugu Asakawa. “ADB’s APVAX support will provide the Government of Mongolia with immediate and flexible financing to vaccinate priority populations, especially those at highest risk from infection, to reduce the impacts of the disease and help put the country on a path to sustained recovery.”

As COVID-19 emerged at the start of 2020, Mongolia responded quickly to avoid the rapid spread of the disease. However, community transmission emerged in November 2020, straining the health system’s capacity. The economy was hard hit, shrinking by 5.3% in 2020, with official job losses reaching 63,900 or 5.4% of total employment. It is expected that COVID-19 will significantly increase the poverty rate from its level of 28.4% in 2018.

Women in Mongolia have been disproportionally affected by the COVID-19 pandemic as they comprise 82% of frontline health workers and have a higher risk of exposure. In addition, the crisis has led to increased gender-based violence, with the number of calls to hotlines and women requiring shelter services rising significantly.

The Support for COVID-19 Vaccine Delivery in Mongolia under APVAX will procure vaccines to contribute to the government’s efforts to immunize at least 30% of the population, representing priority populations as defined under Mongolia’s National Deployment and Vaccination Plan. These include individuals at high risk of death from COVID-19 infection and about 200,000 frontline workers. In addition, people with disabilities, those who suffer from chronic diseases, and vulnerable groups requiring social assistance will benefit from the vaccine rollout.

The total cost of the APVAX project is USD 43.82 million, with ADB providing an ordinary loan and a concessional loan of USD 9.5 million each. ADB Country Director for Mongolia Pavit Ramachandran and Mongolia’s Minister of Finance and ADB Governor Javkhlan Bold signed the loan agreements immediately after the project approval. The Asian Infrastructure Investment Bank plans to provide cofinancing of USD 21 million and the government will contribute USD 3.82 million.

The APVAX project is part of multifaceted and comprehensive support to Mongolia from ADB in response to COVID-19 and builds on ADB’s long track record of assistance to Mongolia’s health system, which includes 7 loans, 10 grants, and 19 technical assistance projects since 1993.

ADB is processing a complementary USD 5 million grant from the Japan Fund for Poverty Reduction to build capacity for COVID-19 vaccine delivery, including equipment for diagnostics and laboratories.

ADB is committed to achieving a prosperous, inclusive, resilient, and sustainable Asia and the Pacific, while sustaining its efforts to eradicate extreme poverty. Established in 1966, it is owned by 68 members—49 from the region.",https://www.montsame.mn/files/60b0c055ea0ab.jpeg,2021-05-28,Montsame,USD19 mln ADB Package to Support Rollout of COVID-19 Vaccines in Mongolia,
2022/1045,News,https://www.montsame.mn/en/read/256638,"On March 12, Mongolia received 14,400 doses of AstraZeneca-Oxford vaccines via the COVAX Facility, a partnership between the Coalition for Epidemic Preparedness Innovations (CEPI), Gavi, the Vaccine Alliance, the World Health Organization (WHO) and UNICEF. 



This delivery is part of a first wave of arrivals that will continue in the coming days and weeks. UNICEF and WHO have been technically, financially and logistically supporting the Government of Mongolia to prepare for the COVID-19 immunization campaign.



“In the battle against this global pandemic, countries around the world have launched the rollout of COVID-19 vaccination. The vaccination campaign in Mongolia started on 23 February 2021 and is accelerating further. We are happy to welcome the arrival of COVID-19 vaccines from the COVAX Facility. Vaccines provided by the COVAX Facility will help to immunize up to 20% of the population. It is a valuable contribution to reach the national vaccination target of 60% of the population in a short period of time,” highlighted Dr Enkhbold Sereejav, Minister of Health of Mongolia.



“Used together with public health measures like handwashing, mask wearing and physical distancing, COVID-19 vaccines are a critical new tool in our fight against the pandemic. This is the first batch of AstraZeneca vaccines delivered by the COVAX Facility backed by partners including WHO, CEPI and Gavi and UNICEF. It will help the Government to scale up the country’s immunization campaign to protect its people. It’s encouraging that Mongolia has already vaccinated over 67,000 people, including priority groups such as health workers. WHO has been supporting the country in its vaccine deployment preparation, and will continue closely working with the Government and partner organizations towards a safe recovery from this pandemic,” said Dr Sergey Diorditsa, WHO Representative to Mongolia.



“UNICEF applauds the Government of Mongolia for intensifying the recently launched COVID-19 immunization campaign. UNICEF will continue to support Mongolia in accessing vaccines via the COVAX Facility and purchasing WHO Emergency Use Listed vaccines through other channels so that the country can successfully implement its National vaccination and deployment plan. We are very grateful to many donors that contribute to COVAX, such as Australia, Canada, the European Union, Japan, Saudi Arabia, Switzerland, the United Kingdom and the United States. Controlling the pandemic will allow children to go back to kindergarten and school, to socialize with friends and to play sports without worries. This is important because they have fallen behind in their education and social development. We need to get them back on track as soon as possible. UNICEF will also continue to support the Government with upgrading the cold chain to ensure safe storage of all vaccines across the country,” said Alex Heikens, UNICEF Representative to Mongolia.



The Ministry of Foreign Affairs of Mongolia has informed that Mongolia is set to receive 112,800 doses of AstraZeneca vaccine and 25,740 doses of Pfizer-BioNTech vaccine in total via the first shipments under the COVAX Facility. ",https://www.montsame.mn/files/604c2eb9ee7a7.jpeg,2021-03-13,Montsame,Mongolia welcomes first batch of COVID-19 vaccines via COVAX Facility,
2022/1046,News,https://www.montsame.mn/en/read/254593,"The charter flight transporting 300 thousand doses of COVID-19 vaccine sent as assistance by the Government of the People’s Republic of China and the Chinese People’s Liberation Army landed at the Buyant-Ukhaa International Airport in Ulaanbaatar city yesterday night on February 22.



Ambassador of China to Mongolia Chai Wenrui and Deputy Prime Minister of Mongolia S.Amarsaikhan participated in a special ceremony that was organized at the airport to hand over the vaccine.

 



 

Deputy PM S.Amarsaikhan said, “I express my sincere gratitude to the Government of the PRC and the people of China for donating 300 thousand doses of vaccine on behalf of the Government of Mongolia and the Mongolian people. Since the start of the COVID-19 infection, Mongolia and China have mutually given material as well as emotional support, becoming a model example of how neighbouring countries are able to cooperate in overcoming difficulties. It must be noted that the assistance given by the Government of China and the people of China including medical tools and equipment such as face masks, PPE, and testing equipment have served as significant support in Mongolia’s fight against the pandemic. I am confident that the vaccines being given as assistance this time will bring our fight against the pandemic to a new level, yielding results in a short amount of time.”



 

Noting that China and Mongolia are friendly neighbours, Ambassador Chai Wenrui said that the two countries have assisted one another since the start of the pandemic, joining forces in the healthcare field. He then continued on to say, “The demand and supply of vaccines is currently a pressing issue worldwide. Despite the current difficulties, assistance of 300 thousand vaccines are being given to Mongolia without a second thought. This event clearly depicts the Comprehensive Strategic Partnership between China and Mongolia as well as the close friendship between the people of the two countries. I am confident that the vaccines will assist more effectively in fighting against the pandemic. China is ready to further cooperate in infection control and jointly overcoming the pandemic, working towards an even more effective partnership in all sectors.”

 



 

To fight against the pandemic, the Government of Mongolia is currently organizing measures to import vaccines from abroad, and plans to involve 60 percent of the population in vaccination.







",https://www.montsame.mn/uploads/content/ad58dbbf4f25f248ee3e7fa2b4d7ccc0.png,2021-02-23,Montsame,Mongolia receives COVID-19 vaccines as assistance from China,
2022/1047,News,https://www.montsame.mn/en/read/254443,"At today’s press briefing on the coronavirus situation in Mongolia, Ts.Ganzorig, Press Secretary of the Cabinet Secretariat confirmed that Mongolia will receive first doses of COVID-19 vaccine developed by China National Pharmaceutical Group Corp, known as Sinopharm, on the evening of February 22, Monday. 



“As China’s Sinopharm vaccine is among the COVID-19 vaccines awaiting approval for emergency use by the World Health Organization, Mongolia will hold the Sinopharm vaccines in reserve once they arrive, making sure they are prepared to roll out, and start vaccinating its population with them after WHO’s approval,” highlighted the government press secretary. 



According to him, Mongolia has also readied cold chain facilities and other required infrastructure to receive COVID-19 vaccines, including Sputnik V, Sinopharm, AstraZeneca and Pfizer vaccines. 



Today, Mongolia received first ever doses of COVID-19 vaccine – 150,000 doses of AstraZeneca from India and is planning to begin the vaccine rollout on February 23, tomorrow. 



As pointed out by Ganzorig, the 150,000 doses of AstraZeneca vaccines received today are enough to vaccinate 75,000 people with priority access is given to frontline employees responding to COVID-19 as the vaccine is supposed to be administered twice. 



In addition, Mongolia is included in the distribution forecast for countries to be allocated COVID-19 vaccines in the first quarter of 2021 through the COVAX Global Vaccines Facility and is expected to receive a total of 188,000 doses of Pfizer and AstraZeneca COVID-19 vaccines.",https://www.montsame.mn/files/603335cb320b0.jpeg,2021-02-22,Montsame,Mongolia to receive first batch of Sinopharm's COVID-19 vaccines today,
2022/1048,News,https://www.montsame.mn/en/read/253952,"Mongolia is planning to bring first doses of Oxford - AstraZeneca COVID-19 vaccine on February 22 and start vaccination immediately from the next day, February 23, in phases. 



For the first phase, MIAT Mongolian Airlines will bring 150,000 doses of the AstraZeneca vaccine from the Republic of India next Monday. 



The cabinet convened on February 17 for a regular meeting and decided to fund necessary expenses for the MIAT direct flight to India from the government’s contingency fund. Corresponding government ministries were charged to take required steps to bring vaccines on scheduled time, deliver the vaccines to destined storage facilities using dedicated vaccine delivery vehicles after they arrive in the country and launch the vaccination in stages. 



At the meeting, the cabinet also made decisions to settle funding to cover expenses required for mobilizing frontline COVID-19 employees working at public streets, isolation facilities and surveillance sites and provide personal protective equipment and disinfection and sterilization products.",https://www.montsame.mn/files/602d0566584b3.jpeg,2021-02-18,Montsame,First doses of COVID-19 vaccines to be brought from India next week,
2022/1049,News,https://www.montsame.mn/en/read/253881,"Gavi, the Global Vaccine Alliance, announced recently the distribution forecast for countries, including Mongolia, to be allocated Covid-19 vaccines through the COVAX Global Vaccines Facility. The UK is one of the largest global donors to the COVAX facility, contributing £548 million. The UK also hosted a “Global Vaccine Summit’’ in June 2020, at which global leaders made historic commitments to enable equal access to vaccines for all. Mongolia will receive doses of both the Pfizer and AstraZeneca Covid-19 vaccines.

On the allocation of vaccines, HMA Malone said ‘’ This is an important milestone in the global fight against Covid-19. The UK has provided strong political and financial support to the COVAX facility since its establishment in 2020, to ensure vaccines reach people in low and middle income countries as quickly as possible.”



Also, on 10 February WHO recommended the use of of AstraZeneca vaccine amongst all adult age groups and recommended a longer period (8-12 weeks) between doses for better immunity. They have also said it is effective against variants of the disease in all countries. ",https://www.montsame.mn/files/602cb698382e1.jpeg,2021-02-17,Montsame,Mongolia to receive COVID-19 vaccines through COVAX Facility,
