2022/1015,Article,https://www.csis.org/analysis/china-exploiting-pandemic-advance-its-interests-mixed-results,"The Covid-19 pandemic has offered China an unprecedented opportunity to shore up its international influence by providing the world with much-needed public health goods. The CSIS China Power Project published a detailed study of China’s “Covid-19 diplomacy,” which assesses the scope and impact of China’s efforts to supply countries with medical aid and vaccines. The study developed a unique Chinese Covid-19 Diplomacy Index (CCDI), which brings together thousands of data points to score countries based on the extent to which China engaged them in medical diplomacy and vaccine diplomacy and how receptive they were to Chinese activities. The study and the index generate important insights into the strengths and weaknesses of China’s approach to Covid-19 diplomacy and the implications for the United States and its partners.

Q1: How has China engaged in Covid-19 diplomacy?

A1: Based on the study’s analysis of Chinese activities from January 2020 to the present, there are six main features of Beijing’s Covid-19 diplomacy:

China’s Covid-19 diplomacy is not primarily based on need or reciprocity. Political and strategic calculations—including the desire to strengthen existing relationships and forge new ones—figure prominently in Beijing’s decisions to provide medical aid or vaccines.

China’s provision of medical aid and vaccines has frequently come with strings attached. For example, where possible, Chinese embassies abroad requested that officials in recipient countries provide public displays of gratitude by participating in handover ceremonies to welcome Chinese medical supplies and vaccines. There is also evidence that Beijing paired its provision of vaccines with requests that recipient country governments defend Chinese stances on issues.

Beijing has sought to project the impression that its medical supplies and vaccines were donations. Yet more than 99 percent of China’s exports of personal protective equipment (PPE) in 2020 were sold, not donated, and about 96 percent of its vaccine exports were likewise sold.

While the United States and many other wealthy countries have donated large quantities of vaccines to COVAX (a global initiative to promote equitable access to Covid-19 vaccines), China predominantly engages countries bilaterally in order to augment its bilateral influence. Only about 16 percent of Chinese vaccine exports have been allocated to COVAX or other multilateral mechanisms, and much of this was in the form of sales.

With both medical supplies and vaccines, China has prioritized speed over quality in order to reap first-mover advantages.

China’s Covid-19 diplomacy has been accompanied by aggressive Chinese information and disinformation campaigns—a topic that the China Power team will cover in detail in its next feature.
Q2: Is China succeeding at advancing its interests through Covid-19 diplomacy?

A2: China has had mixed success in advancing its interests through its Covid-19 diplomacy.

The CCDI reveals that China’s activities likely earned Beijing goodwill and influence in several middle-income countries along China’s periphery (such as Kyrgyzstan, Cambodia, Mongolia, and Indonesia), in sub-Saharan Africa (including Comoros, Zimbabwe, and the Republic of Congo), and in Serbia. Two high-income countries—Hungary and Chile—also ranked highly in the CCDI, suggesting China had sizeable influence there.

These findings indicate Chinese activities could have improved Beijing’s image and helped strengthen its relationships with countries that sought, or already enjoyed, strong relationships with China. In some countries, there is some evidence that providing vaccines enabled Beijing to advance its foreign policy objectives. Hungary, for example, blocked EU statements criticizing China in April 2021, just a few weeks after the country purchased millions of doses of Chinese vaccines.

At the same time, there are examples of vaccine diplomacy not winning China foreign policy victories. Amid a painful Covid-19 outbreak, officials in Paraguay publicly toyed with switching official diplomatic ties from Taiwan to mainland China, but authorities in Asunción ultimately chose not to do so. Furthermore, Beijing’s heavy-handed approach may have worsened its relations with some countries, especially wealthy democratic countries.

A major limiting factor in China’s vaccine diplomacy has been Beijing’s preference to sell vaccines and to provide them bilaterally. Most of China’s vaccines have gone to middle-income countries, leaving many of the poorest countries highly vulnerable. This has limited Beijing’s reach and undercut its attempts to cast itself as a benevolent guarantor of global public health.

Finally, the overall impact of China’s vaccine diplomacy has been watered down by concerns about the efficacy and safety of Chinese vaccines. Health authorities in at least 10 countries have suspended the use of Chinese vaccines, recommended pairing them with non-Chinese booster shots, or pushed back on them in some other way due to safety and efficacy concerns. China’s provision of medical supplies was similarly hindered by quality concerns, as some Chinese exported products were found to be fake or counterfeit.

Q3: What are the implications of China’s Covid-19 diplomacy for the United States and its partners?

A3: These findings suggest three main implications for the United States and its allies and partners. First, China did not fully seize the opportunity it had after it contained Covid-19 at home in early 2020. There was tremendous international outpouring of public health aid to China in early 2020 and China did not capitalize on that to strengthen relationships globally. Instead, China’s heavy-handed public diplomacy polarized its relationships with a number of countries. For the international community, Beijing’s response to the pandemic is a lesson learned in how Chinese diplomatic efforts and capabilities may not match, or at times even support, its broader ambitions.

Second, the United States does not necessarily need to compete with China on the provision of vaccines globally or seek to match Chinese vaccines dose-for-dose. Fast and early Chinese exports of its vaccines abroad have neither guaranteed sustained Chinese influence (particularly as other non-Chinese vaccines became available) nor caused China to have outsized and undue influence over recipient countries. Countries respond to what Beijing delivers and they take into account the efficacy of Chinese vaccines. The United States and its allies and partners should focus on ensuring widespread availability of high-quality vaccines based on public health needs.

Third, China’s public health diplomacy is wanting in many ways and has not matched the image that China seeks to project regarding its global health leadership. The United States should encourage China to donate rather than sell more vaccines to countries. It should particularly encourage China to donate more vaccines to COVAX. Finally, Washington should call on China to drop its requests that recipient countries demonstrate public displays of gratitude to China or align themselves with Chinese foreign policy goals.",,"September 30, 2021",Centre for Strategic and International Studies,"China Is Exploiting the Pandemic to Advance Its Interests, with Mixed Results | Center for Strategic and International Studies",
2022/1016,Article,https://www.nytimes.com/2021/05/20/business/coronavirus-vaccine-mongolia.html,"Mongolia, a country of grassy hills, vast deserts and endless skies, has a population not much bigger than Chicago’s. The small democratic nation is used to living in the shadow of its powerful neighbors, Russia and China.

But during a pandemic, being a small nation sandwiched between two vaccine makers with global ambitions can have advantages.

At a time when most countries are scrambling for coronavirus vaccines, Mongolia now has enough to fully vaccinate its entire adult population, in large part thanks to deals with both China and Russia. Officials are so confident about the nation’s vaccine riches that they are promising citizens a “Covid-free summer.”

Mongolia’s success in procuring the vaccines in the span of a few months is a big victory for a low-income, developing nation. Many poor countries have been waiting in line for shots, hoping for the best. But Mongolia, using its status as a small geopolitical player between Russia and China, was able to snap up doses at a clip similar to that of much wealthier countries.

“It speaks to the Mongolian ability to play to the two great powers and maximize their benefits even while they are on this tightrope between these two countries,” said Theresa Fallon, director of the Center for Russia Europe Asia Studies in Brussels.

It is also a win for China and Russia, which have extensive resource interests in Mongolia and ambitions to appear to play a role in ending the pandemic, even when much of the world has expressed deep skepticism over their homegrown vaccines.

Mongolia is a buffer between eastern Russia, which is resource rich and mostly unpopulated, and China, which is crowded and hungry for resources. While Russia and China are often aligned on the global stage, they have a history of conflict and are wary of each others’ interests in Mongolia. Those suspicions can be seen in their vaccine diplomacy.

Image
In Ulaanbaatar, the capital, 97 percent of the adult population has received a first dose and more than half are fully vaccinated, according to government statistics. 
In Ulaanbaatar, the capital, 97 percent of the adult population has received a first dose and more than half are fully vaccinated, according to government statistics. Credit...Khasar Sandag for The New York Times

“Putin is deeply concerned about what China is doing in their neighborhood,” Ms. Fallon said of Russia’s president, Vladimir V. Putin.

Russia has sold Mongolia one million doses of its Sputnik V vaccine. China has provided four million doses of vaccine — the final shipment of doses arrived this week. Mongolia’s most recent agreement with China’s Sinopharm Group, which is state-owned, was made days before the company received emergency authorization from the World Health Organization.

Read More on China
A Long-Awaited Report: After a nearly yearlong delay, the United Nations released its assessment of the mass detention of Uyghurs and other Muslim groups in China, accusing the country’s leadership of human rights violations.
A Choreographed Ritual: Chinese officials said that a Communist Party congress that is poised to anoint Mr. Xi as China’s top leader for another five years will open in Beijing on Oct. 16.
The Struggles of Shenyang: The city, in China’s northeast, was a hub for North Korean workers and a launchpad for visits to Pyongyang. Covid restrictions have battered its economy.
Real Estate Crisis: As China’s economy stumbles, homeowners who bought property from indebted developers are boycotting mortgage payments on unfinished properties.
Mongolia was late to the global clamber for Covid-19 vaccines. For nearly a year officials boasted that there were no local cases. Then came an outbreak in November. Two months later, political crisis precipitated by the mishandling of the virus led to the sudden resignation of the prime minister. The prospect of continued coronavirus restrictions threatened to throw the country into further political turmoil.

The new prime minister, Oyun-Erdene Luvsannamsrai, pledged to restart the economy, which had suffered from lockdowns and border closures, particularly in the south, where Mongolian truck drivers ferry coal across the border to China’s steel mills. But these plans were complicated by surging cases, with the daily count going from hundreds a day to thousands.

“We were quite desperate,” said Bolormaa Enkhbat, an economic and development policy adviser to the prime minister.

Editors’ Picks

Ken Burns Explores America’s Inaction During the Holocaust

‘A Decade of Fruitless Searching’: The Toll of Dating App Burnout

Two Children, Two Cats and a Dog (and 250 Mice): She Needed a New Plan. Which Option Would You Choose?
Image
The new prime minister pledged to restart the economy, which suffered from coronavirus lockdowns. 
The new prime minister pledged to restart the economy, which suffered from coronavirus lockdowns. Credit...Khasar Sandag for The New York Times

Mongolia approached China and Russia first, the foreign minister said, hoping longstanding economic ties with each country would help move it to the front of the line of countries seeking vaccines. Officials simultaneously explored diplomatic and private channels — putting in requests for donations from rich countries and the world’s biggest vaccine manufacturers.

They contacted price-gouging middlemen, international health organizations and vaccine alliances for poorer countries. One intermediary offered to sell Pfizer-BioNTech’s Covid vaccine for $120 a shot, nearly a quarter of the average monthly salary, Ms. Enkhbat said. Covax, the global vaccine-sharing alliance, which Mongolia signed onto in July 2020, promised doses in the fall or winter.

With each breakthrough from Russia, negotiations moved more quickly with China.

In early February, Mongolia approved Russia’s Sputnik V vaccine. Three days later, China’s Sinopharm Group received approval for its Vero Cell vaccine. Soon after, China donated 300,000 doses of its Sinopharm vaccine to Mongolia, citing a “profound traditional friendship” as motivation.

Opening up more of the border between China and Mongolia was also a part of the vaccine discussions, Chinese and Mongolian officials said in Chinese state media. Mongolia needs China to buy its coal — exports to the country make up nearly a quarter of Mongolia’s annual economic growth. The revenues helped to pad Mongolia’s budget by a quarter last year.

After a month of back and forth, the Mongolian government struck a deal in March with Russia’s Gamaleya Research Institute, too, for one million doses of the Sputnik vaccine. Days later, Mongolia finalized an agreement to buy 330,000 additional doses of the Sinopharm vaccine.

Image
Officials are so confident about Mongolia’s vaccine riches that they are promising citizens a “Covid-free summer.”
Officials are so confident about Mongolia’s vaccine riches that they are promising citizens a “Covid-free summer.”Credit...Khasar Sandag for The New York Times

When there was a last-minute hitch in the delivery of the purchased Chinese vaccines, a call on April 7 between China’s premier, Li Keqiang, and Mongolia’s prime minister, helped to smooth things over and reassure both sides. Up to that point, it was still unclear if Mongolia would be able to rely on China or if it would need to return to Russia for more vaccines.

“That’s what paved the way for the rest of the deal,” Ms. Enkhbat said about the phone call between the two men. “We laid out the situation and said that we are betting on Chinese vaccines at a time when the rest of the world fully isn’t.”

Mongolia has also secured commitments from AstraZeneca and Pfizer-BioNTech. So far it has received only 60,000 of the Sputnik vaccine because of manufacturing delays. But the Chinese vaccine will account for a majority of Covid-19 shots for Mongolia’s population.

“We are thankful to our partners, especially China, that they are providing us with vaccinations when they also need it for domestic use,” said Battsetseg Batmunkh, Mongolia’s foreign minister.

The Chinese and Russian embassies in Mongolia did not respond to requests for comment.

In Ulaanbaatar, Mongolia’s capital, 97 percent of the adult population has received a first dose and more than half are fully vaccinated, according to government statistics. Across the country, more than three quarters of Mongolians have already received one shot.

Image
Coal exports to China make up nearly a quarter of Mongolia’s annual economic growth.
Coal exports to China make up nearly a quarter of Mongolia’s annual economic growth.Credit...Gilles Sabrie for The New York Times

The country’s vaccination effort still faces hurdles. Mongolia is economically dependent on China, and many of its citizens continue to fear its power and influence. When tensions have arisen in the past, China has shut its border and stopped purchasing Mongolian coal.

Mongolians have also expressed a preference for Russia’s Sputnik vaccine. To get the population to take the Sinopharm shot, the government has offered each citizen 50,000 tugriks — about $18 — to get fully vaccinated. The average monthly salary in 2020 was $460.

The terms and pricing of the Sinopharm and Sputnik deals were not made public, and Mongolia’s foreign ministry declined to comment on pricing. Representatives for the Gamaleya Research Institute and Sinopharm did not respond to requests for comment.

While some global health experts have questioned whether Sinopharm will be able to continue to deliver on its commitments overseas, it has delivered all of the doses Mongolia ordered. China has said it can make as many as five billion doses by the end of the year, though officials have warned that the country is struggling to make enough shots for its citizens.

There are also some signs that governments that have chosen the Sinopharm vaccine may have to roll out a third booster shot sooner than expected.

China, for its part, may be playing a long game, said Julian Dierkes, an associate professor at the University of British Columbia who specializes in Mongolian politics. Though many Mongolians may still not trust China, the Mongolian government will remember how it made its vaccines available at a critical moment.

“We could coin a phrase here: ‘The opportunity of smallness,’” he said.",https://static01.nyt.com/images/2021/05/13/business/00Virus-Mongolia1/merlin_187693854_bb14aeba-d0b6-4a4c-918d-9fb133e1e34d-superJumbo.jpg?quality=75&auto=webp,"May 20, 2021",New York TImes,Countries Are Scrambling for Vaccines. Mongolia Has Plenty. - The New York Times,
